{
  "$schema": "https://json-schema.org/draft/2020-12/schema",
  "title": "LLM Wiki Manual Mutate Defect Registry",
  "type": "object",
  "additionalProperties": false,
  "required": [
    "$schema",
    "vault",
    "generated_at",
    "artifact_kind",
    "producer",
    "source_command",
    "source_revision",
    "source_tree_fingerprint",
    "input_fingerprints",
    "schema_version",
    "artifact_status",
    "retention_policy",
    "encoding",
    "currentness",
    "policy",
    "status",
    "summary",
    "defects"
  ],
  "properties": {
    "$schema": {
      "type": "string",
      "enum": [
        "ops/schemas/manual-mutate-defect-registry.schema.json"
      ]
    },
    "vault": {
      "type": "string"
    },
    "generated_at": {
      "type": "string",
      "pattern": "^\\d{4}-\\d{2}-\\d{2}T\\d{2}:\\d{2}:\\d{2}Z$"
    },
    "artifact_kind": {
      "type": "string",
      "minLength": 1
    },
    "producer": {
      "type": "string",
      "minLength": 1
    },
    "source_command": {
      "type": "string",
      "minLength": 1
    },
    "source_revision": {
      "type": "string",
      "minLength": 1
    },
    "source_tree_fingerprint": {
      "type": "string",
      "minLength": 1
    },
    "input_fingerprints": {
      "type": "object",
      "additionalProperties": {
        "type": "string",
        "minLength": 1
      }
    },
    "schema_version": {
      "type": "integer",
      "minimum": 1
    },
    "artifact_status": {
      "type": "string",
      "enum": ["current", "archived", "stale", "unknown"]
    },
    "retention_policy": {
      "type": "string",
      "enum": ["ephemeral", "canonical_report", "archive"]
    },
    "encoding": {
      "type": "string",
      "enum": ["utf-8"]
    },
    "currentness": {
      "type": "object",
      "additionalProperties": false,
      "required": ["status", "checked_at"],
      "properties": {
        "status": {
          "type": "string",
          "enum": ["current", "stale", "unknown", "invalid"]
        },
        "checked_at": {
          "type": "string",
          "pattern": "^\\d{4}-\\d{2}-\\d{2}T\\d{2}:\\d{2}:\\d{2}Z$"
        }
      }
    },
    "policy": {
      "$ref": "#/$defs/policy_identity"
    },
    "status": {
      "type": "string",
      "enum": ["pass", "attention"]
    },
    "summary": {
      "type": "object",
      "additionalProperties": false,
      "required": [
        "manual_mutate_script_count",
        "registered_defect_count",
        "fixed_defect_count",
        "covered_regression_count",
        "unresolved_or_uncovered_count"
      ],
      "properties": {
        "manual_mutate_script_count": { "type": "integer", "minimum": 0 },
        "registered_defect_count": { "type": "integer", "minimum": 0 },
        "fixed_defect_count": { "type": "integer", "minimum": 0 },
        "covered_regression_count": { "type": "integer", "minimum": 0 },
        "unresolved_or_uncovered_count": { "type": "integer", "minimum": 0 }
      }
    },
    "defects": {
      "type": "array",
      "items": {
        "$ref": "#/$defs/defect"
      }
    }
  },
  "$defs": {
    "policy_identity": {
      "type": "object",
      "additionalProperties": false,
      "required": ["path", "version"],
      "properties": {
        "path": { "type": "string" },
        "version": { "type": ["integer", "string"] }
      }
    },
    "defect": {
      "type": "object",
      "additionalProperties": false,
      "required": [
        "defect_id",
        "script_path",
        "script_sha256",
        "defect_class",
        "target_paths",
        "canonical_fix_status",
        "regression_status",
        "canonical_fix_refs",
        "regression_tests",
        "evidence",
        "notes"
      ],
      "properties": {
        "defect_id": {
          "type": "string",
          "pattern": "^[a-z0-9][a-z0-9_-]*$"
        },
        "script_path": { "type": "string", "minLength": 1 },
        "script_sha256": {
          "type": "string",
          "pattern": "^[a-f0-9]{64}$"
        },
        "defect_class": {
          "type": "string",
          "enum": [
            "decision_provenance_loss",
            "telemetry_merge_simplification",
            "timeout_telemetry_loss",
            "unclassified_manual_mutation"
          ]
        },
        "target_paths": {
          "type": "array",
          "items": { "type": "string", "minLength": 1 }
        },
        "canonical_fix_status": {
          "type": "string",
          "enum": ["fixed", "partial", "unresolved"]
        },
        "regression_status": {
          "type": "string",
          "enum": ["covered", "partial", "missing"]
        },
        "canonical_fix_refs": {
          "type": "array",
          "items": { "type": "string", "minLength": 1 }
        },
        "regression_tests": {
          "type": "array",
          "items": { "type": "string", "minLength": 1 }
        },
        "evidence": {
          "type": "array",
          "items": {
            "$ref": "#/$defs/evidence"
          }
        },
        "notes": { "type": "string" }
      }
    },
    "evidence": {
      "type": "object",
      "additionalProperties": false,
      "required": ["path", "present_markers", "missing_markers"],
      "properties": {
        "path": { "type": "string", "minLength": 1 },
        "present_markers": {
          "type": "array",
          "items": { "type": "string", "minLength": 1 }
        },
        "missing_markers": {
          "type": "array",
          "items": { "type": "string", "minLength": 1 }
        }
      }
    }
  }
}
